{
  "$schema": "http://json-schema.org/draft-07/schema#",
  "$id": "https://developer.bigcommerce.com/schemas/changelog-entry.json",
  "title": "Changelog Entry",
  "description": "Schema for BigCommerce documentation changelog entries",
  "type": "object",
  "required": ["id", "timestamp", "type", "title", "description", "affectedDocs"],
  "properties": {
    "id": {
      "type": "string",
      "description": "Unique identifier for this changelog entry",
      "pattern": "^[a-z0-9-]+$"
    },
    "timestamp": {
      "type": "string",
      "description": "ISO 8601 timestamp when the entry was created",
      "format": "date-time"
    },
    "type": {
      "type": "string",
      "description": "Type of change",
      "enum": ["added", "changed", "deprecated", "removed", "fixed", "security"]
    },
    "title": {
      "type": "string",
      "description": "Brief, user-friendly title for the change",
      "minLength": 10,
      "maxLength": 200
    },
    "description": {
      "type": "string",
      "description": "Detailed description of the change and its impact",
      "minLength": 20
    },
    "affectedDocs": {
      "type": "array",
      "description": "List of documentation pages affected by this change",
      "minItems": 1,
      "items": {
        "type": "object",
        "required": ["path", "url"],
        "properties": {
          "path": {
            "type": "string",
            "description": "Relative file path from repository root"
          },
          "url": {
            "type": "string",
            "description": "Public URL path for the documentation page"
          },
          "title": {
            "type": "string",
            "description": "Title of the documentation page"
          }
        }
      }
    },
    "author": {
      "type": "string",
      "description": "GitHub username of the author"
    },
    "prNumber": {
      "type": "integer",
      "description": "Pull request number associated with this change",
      "minimum": 1
    },
    "tags": {
      "type": "array",
      "description": "Optional tags for categorization",
      "items": {
        "type": "string"
      }
    },
    "breaking": {
      "type": "boolean",
      "description": "Whether this is a breaking change",
      "default": false
    }
  }
}
