{
  "id": "1730322000000-abc123",
  "timestamp": "2025-10-30T20:00:00.000Z",
  "type": "added",
  "title": "Automatic changelog management system",
  "description": "Introduced a new automated changelog management system inspired by changesets. Documentation contributors can now create changelog entries alongside their changes, which are automatically aggregated and published on a regular cadence.",
  "affectedDocs": [
    {
      "path": ".changelogs/README.md",
      "url": "/.changelogs/README",
      "title": "Changelog Management System"
    },
    {
      "path": "docs/changelog/README.mdx",
      "url": "/docs/changelog",
      "title": "Documentation Changelog"
    }
  ],
  "author": "devdocs-team",
  "tags": ["automation", "changelog", "documentation"],
  "breaking": false
}
